tax_id,company_name,company_name_norm,registration_date,registration_date_norm,company_type,address,address_norm,business_line,canonical_key
313597352,CÔNG TY TNHH MỘT THÀNH VIÊN THƯƠNG MẠI XUẤT NHẬP KHẨU XUÂN NHI,CÔNG TY Trách nhiệm hữu hạn MỘT THÀNH VIÊN THƯƠNG MẠI XUẤT NHẬP KHẨU XUÂN NHI,04/01/2016,2016-01-04,Công ty trách nhiệm hữu hạn một thành viên,"145/16B Đề Thám, Phường Cô Giang, Quận 1, Thành phố Hồ Chí Minh, Việt Nam","145/16B Đề Thám, Phường Cô Giang, Quận 1, Thành phố Hồ Chí Minh, Việt Nam","4722: Bán lẻ thực phẩm trong các cửa hàng chuyên doanh-Chi tiêt: Bán lẻ thực phẩm chức năng (thực hiện theo quyết định 64/2009/QĐ-UBND ngày 31/07/2009 của UBND Thành Phố Hồ Chí Minh và quyết định 79/2009/QĐ-UBND ngày 17/10/2009 của UBND Thành Phố Hồ Chí Minh về quy hoạch nông sản, thực phẩm trên địa bàn TP Hồ Chí Minh).;4771: Bán lẻ hàng may mặc, giày dép, hàng da và giả da trong các cửa hàng chuyên doanh-;4772: Bán lẻ thuốc, dụng cụ y tế, mỹ phẩm và vật phẩm vệ sinh trong các cửa hàng chuyên doanh-Chi tiết: Bán lẻ nước hoa, mỹ phẩm và vật phẩm vệ sinh trong các cửa hàng chuyên doanh;4632: Bán buôn thực phẩm-Chi tiết: _x000D_
- Bán buôn thực phẩm chức năng_x000D_
- Bán buôn đường, sữa và các sản phẩm sữa,bánh kẹo và các sản phẩm chế biến từ ngũ cốc, bột, tinh bột ( không bán buôn đường tại trụ sở);4641: Bán buôn vải, hàng may sẵn, giày dép-Chi tiết: Bán buôn hàng may mặc;4649: Bán buôn đồ dùng khác cho gia đình-Chi tiết: _x000D_
- Bán buôn nước hoa, hàng mỹ phẩm và chế phẩm vệ sinh_x000D_
- Bán buôn thuốc;8299: Hoạt động dịch vụ hỗ trợ kinh doanh khác còn lại chưa được phân vào đâu-Chi tiết: Dịch vụ bảo quản thuốc;",công ty trách nhiệm hữu hạn một thành viên thương mại xuất nhập khẩu xuân nhi | 313597352
313598123,CÔNG TY TNHH ĐÁ GRANITE THANH HÀ,CÔNG TY Trách nhiệm hữu hạn ĐÁ GRANITE THANH HÀ,04/01/2016,2016-01-04,Công ty trách nhiệm hữu hạn hai thành viên trở lên,"31/2 khu phố 1, Quốc Lộ 1A , phường Thạnh Xuân, Quận 12, Thành phố Hồ Chí Minh, Việt Nam","31/2 khu phố 1, Quốc Lộ 1A , phường Thạnh Xuân, Quận 12, Thành phố Hồ Chí Minh, Việt Nam","2396: Cắt tạo dáng và hoàn thiện đá-Chi tiết: Cắt, tạo dáng, hoàn thiện sản phẩm đá sử dụng trong xây dựng, sản xuất đồ gia dụng bằng đá (không hoạt động tại trụ sở);5229: Hoạt động dịch vụ hỗ trợ khác liên quan đến vận tải-( trừ hóa lỏng khí để vận chuyển và hoạt động vận tải liên quan đến đường hàng không);4662: Bán buôn kim loại và quặng kim loại-Chi tiết: Bán buôn sắt thép. Bán buôn kim loại khác (trừ vàng miếng);4663: Bán buôn vật liệu, thiết bị lắp đặt khác trong xây dựng-Chi tiết: Bán buôn tre nứa, gỗ cây và gỗ chế biến.;4669: Bán buôn chuyên doanh khác chưa được phân vào đâu-Chi tiết: Bán buôn đá hoa cương, đá granit, đá cẩm thạch;;4100: Xây dựng nhà các loại-;4290: Xây dựng công trình kỹ thuật dân dụng khác-Chi tiết: Xây dựng công trình dân dụng và công nghiệp;4321: Lắp đặt hệ thống điện-Chi tiết: Lắp đặt hệ thống điện; hệ thống phòng cháy - chữa cháy; hệ thống chống trộm; camera quan sát; hệ thống chống sét; hệ thống quản lý khóa cửa; hệ thống máy bấm thẻ; hệ thống nhận dấu vân tay (không gia công cơ khí, tái chế phế thải, xi mạ điện tại trụ sở);4322: Lắp đặt hệ thống cấp, thoát nước, lò sưởi và điều hoà không khí-(trừ gia công cơ khí, tái chế phế thải, xi mạ điện tại trụ sở và trừ lắp đặt các thiết bị lạnh (thiết bị cấp đông, kho lạnh, máy đá, điều hòa không khí, làm lạnh nước) sử dụng ga lạnh r22 trong lĩnh vực chế biến thủy - hải sản));4330: Hoàn thiện công trình xây dựng-Chi tiết: Lắp đặt trong các tòa nhà hoặc các công trình khác bằng đá lát sàn, đá hoa cương, granit, đá cẩm thạch hoặc các tấm phủ tường hoặc sàn (không hoạt động tại trụ sở);4511: Bán buôn ô tô và xe có động cơ khác-Chi tiết: Bán buôn ô tô và xe có động cơ loại mới và loại đã qua sử dụng;4512: Bán lẻ ô tô con (loại 12 chỗ ngồi trở xuống)-Chi tiết: Bán lẻ ô tô con loại 12 chỗ ngồi trở xuống loại mới và loại đã qua sử dụng;4659: Bán buôn máy móc, thiết bị và phụ tùng máy khác-Chi tiết: Bán buôn máy móc, thiết bị điện, vật liệu điện (máy phát điện, động cơ điện, dây điện và thiết bị khác dùng trong mạch điện).;4933: Vận tải hàng hóa bằng đường bộ-Chi tiết: Vận tải hàng hóa bằng ô tô loại khác (trừ ô tô chuyên dụng);7710: Cho thuê xe có động cơ-Chi tiết: cho thuê xe ô tô;Doanh nghiệp phải thực hiện đúng các quy định của pháp luật về đất đai, xây dựng, phòng cháy chữa cháy, bảo vệ môi trường, các quy định khác của pháp luật hiện hành và các điều kiện kinh doanh đối với ngành nghề kinh doanh có điều kiện; ",công ty trách nhiệm hữu hạn đá granite thanh hà | 313598123
313598412,CÔNG TY TNHH MATSUMURA VIỆT NAM,CÔNG TY Trách nhiệm hữu hạn MATSUMURA VIỆT NAM,04/01/2016,2016-01-04,Công ty trách nhiệm hữu hạn một thành viên,"565/1 Lê Văn Thọ, Phường 14, Quận Gò Vấp, Thành phố Hồ Chí Minh, Việt Nam","565/1 Lê Văn Thọ, Phường 14, Quận Gò Vấp, Thành phố Hồ Chí Minh, Việt Nam","4669: Bán buôn chuyên doanh khác chưa được phân vào đâu--chi tiết: Bán buôn, xuất nhập khẩu dầu máy dùng trong công nghiệp;4773: Bán lẻ hàng hóa khác mới trong các cửa hàng chuyên doanh--chi tiết: Bán lẻ dầu máy dùng trong công nghiệp;",công ty trách nhiệm hữu hạn matsumura việt nam | 313598412
313597345,CÔNG TY TNHH PHÚ SƠN BÌNH PHƯỚC,CÔNG TY Trách nhiệm hữu hạn PHÚ SƠN BÌNH PHƯỚC,04/01/2016,2016-01-04,Công ty trách nhiệm hữu hạn hai thành viên trở lên,"Lầu 1 Số 29 Đường 152A Cao Lỗ, Phường 4, Quận 8, Thành phố Hồ Chí Minh, Việt Nam","Lầu 1 Số 29 Đường 152A Cao Lỗ, Phường 4, Quận 8, Thành phố Hồ Chí Minh, Việt Nam","2212: Sản xuất sản phẩm khác từ cao su-Chi tiết: Sản xuất chế biến mủ cao su (không hoạt động tại trụ sở);0125: Trồng cây cao su-(không hoạt động tại trụ sở);0145: Chăn nuôi lợn-(không hoạt động tại trụ sở);0146: Chăn nuôi gia cầm-(không hoạt động tại trụ sở);1080: Sản xuất thức ăn gia súc, gia cầm và thuỷ sản-Chi tiết: Sản xuất thức ăn gia súc, gia cầm và thuỷ sản (không sản xuất tại trụ sở);4661: Bán buôn nhiên liệu rắn, lỏng, khí và các sản phẩm liên quan-Chi tiết: Bán buôn xăng, dầu và các sản phẩm có liên quan (trừ kinh doanh khí dầu mỏ hóa lỏng LPG và không kinh doanh dầu nhớt cặn tại trụ sở);",công ty trách nhiệm hữu hạn phú sơn bình phước | 313597345
