tax_id,company_name,company_name_norm,registration_date,registration_date_norm,company_type,address,address_norm,business_line,canonical_key
313597320,CÔNG TY TNHH LAVITA,CÔNG TY Trách nhiệm hữu hạn LAVITA,04/01/2016,2016-01-04,Công ty trách nhiệm hữu hạn hai thành viên trở lên,"32-Đ6 Sài Gòn Pearl Villas-92 Nguyễn Hữu Cảnh, Phường 22, Quận Bình Thạnh, Thành phố Hồ Chí Minh, Việt Nam","32-Đ6 Sài Gòn Pearl Villas-92 Nguyễn Hữu Cảnh, Phường 22, Quận Bình Thạnh, Thành phố Hồ Chí Minh, Việt Nam","1621: Sản xuất gỗ dán, gỗ lạng, ván ép và ván mỏng khác-(không hoạt động tại trụ sở);1622: Sản xuất đồ gỗ xây dựng-(không hoạt động tại trụ sở);1623: Sản xuất bao bì bằng gỗ-(không hoạt động tại trụ sở);1629: Sản xuất sản phẩm khác từ gỗ; sản xuất sản phẩm từ tre, nứa, rơm, rạ và vật liệu tết bện-Chi tiết: Sản xuất sản phẩm khác từ gỗ; sản xuất sản phẩm từ lâm sản (trừ gỗ), cói và và vật liệu tết bện (trừ sản xuất bột giấy, tái chế phế thải, chế biến gỗ);5510: Dịch vụ lưu trú ngắn ngày-(không hoạt động tại TP HCM);4662: Bán buôn kim loại và quặng kim loại-;4663: Bán buôn vật liệu, thiết bị lắp đặt khác trong xây dựng-;4669: Bán buôn chuyên doanh khác chưa được phân vào đâu-Chi tiết: Bán buôn hóa chất công nghiệp;3100: Sản xuất giường, tủ, bàn, ghế-;4100: Xây dựng nhà các loại-;4210: Xây dựng công trình đường sắt và đường bộ-;4311: Phá dỡ-;4312: Chuẩn bị mặt bằng-;4330: Hoàn thiện công trình xây dựng-;4511: Bán buôn ô tô và xe có động cơ khác-;4530: Bán phụ tùng và các bộ phận phụ trợ của ô tô và xe có động cơ khác-;4610: Đại lý, môi giới, đấu giá-Chi tiết: Đại lý, môi giới (trừ kinh doanh bất động sản);4632: Bán buôn thực phẩm-(không hoạt động tại trụ sở);4633: Bán buôn đồ uống-(trừ kinh doanh ăn uống);4641: Bán buôn vải, hàng may sẵn, giày dép-;4649: Bán buôn đồ dùng khác cho gia đình-Chi tiết: Bán buôn vali, cặp, túi, ví, hàng da và giả da. Bán buôn hàng gốm, sứ, thủy tinh. Bán buôn đồ điện gia dụng, đèn và bộ đèn điện. Bán buôn giường, tủ, bàn ghế và đồ dùng nội thất. Bán buôn sách-báo-tạp chí (có nội dung được phép lưu hành), văn phòng phẩm.;4651: Bán buôn máy vi tính, thiết bị ngoại vi và phần mềm-;4652: Bán buôn thiết bị và linh kiện điện tử, viễn thông-;4653: Bán buôn máy móc, thiết bị và phụ tùng máy nông nghiệp-;4659: Bán buôn máy móc, thiết bị và phụ tùng máy khác-Chi tiết: Bán buôn máy móc, thiết bị và phụ tùng máy khai khoáng, xây dựng. Bán buôn máy móc, thiết bị điện, vật liệu điện (máy phát điện, động cơ điện, dây điện và thiết bị khác dùng trong mạch điện). Bán buôn máy móc, thiết bị và phụ tùng văn phòng.;7410: Hoạt động thiết kế chuyên dụng-(trừ thiết kế công trình);",công ty trách nhiệm hữu hạn lavita | 313597320
313597507,CÔNG TY TNHH ĐẦU TƯ PHÁT TRIỂN KHÁCH SẠN SÀI GÒN,CÔNG TY Trách nhiệm hữu hạn ĐẦU TƯ PHÁT TRIỂN KHÁCH SẠN SÀI GÒN,04/01/2016,2016-01-04,Công ty trách nhiệm hữu hạn một thành viên,"Số 1122/1 Quang Trung, Phường 8, Quận Gò Vấp, Thành phố Hồ Chí Minh, Việt Nam","Số 1122/1 Quang Trung, Phường 8, Quận Gò Vấp, Thành phố Hồ Chí Minh, Việt Nam","5510: Dịch vụ lưu trú ngắn ngày--Chi tiết: Kinh doanh khách sạn (được công nhận xếp hạng từ 1 sao trở lên);8699: Hoạt động y tế khác chưa được phân vào đâu--Chi tiết: Khám bệnh, chữa bệnh bằng y học cổ truyền (không có bệnh nhân lưu trú);",công ty trách nhiệm hữu hạn đầu tư phát triển khách sạn sài gòn | 313597507
313587386,CÔNG TY TRÁCH NHIỆM HỮU HẠN MỘT THÀNH VIÊN DỊCH VỤ MẶT ĐẤT SÂN BAY VIỆT NAM,CÔNG TY TRÁCH NHIỆM HỮU HẠN MỘT THÀNH VIÊN DỊCH VỤ MẶT ĐẤT SÂN BAY VIỆT NAM,01/01/2016,2016-01-01,Công ty trách nhiệm hữu hạn một thành viên,"Số 49 Trường Sơn, Phường 2, Quận Tân Bình, Thành phố Hồ Chí Minh, Việt Nam","Số 49 Trường Sơn, Phường 2, Quận Tân Bình, Thành phố Hồ Chí Minh, Việt Nam","8559: Giáo dục khác chưa được phân vào đâu-Chi tiết: Dạy ngoại ngữ và dạy kỹ năng đàm thoại, đào tạo về sự sống, các khóa dạy về phê bình, đánh giá chuyên môn, đào tạo kỹ năng nói trước công chúng; 8560: Dịch vụ hỗ trợ giáo dục-Chi tiết: Tư vấn giáo dục; Dịch vụ đưa ra ý kiến hướng dẫn về giáo dục; Dịch vụ đánh giá việc kiểm tra giáo dục; Dịch vụ kiểm tra giáo dục; 8531: Đào tạo sơ cấp-Chi tiết: Huấn luyện nhân viên kỹ thuật và các nhân viên chuyên ngành hàng không khác; 1104: Sản xuất đồ uống không cồn, nước khoáng-Chi tiết: Sản xuất nước khoáng, nước tinh khiết đóng chai; 4530: Bán phụ tùng và các bộ phận phụ trợ của ô tô và xe có động cơ khác-; 8230: Tổ chức giới thiệu và xúc tiến thương mại-(không thực hiện các hiệu ứng cháy, nổ; không sử dụng chất nổ, chất cháy, hóa chất làm đạo cụ, dụng cụ thực hiện các chương trình văn nghệ, sự kiện, phim ảnh).; 4931: Vận tải hành khách đường bộ trong nội thành, ngoại thành (trừ vận tải bằng xe buýt)-; 4932: Vận tải hành khách đường bộ khác-; 4933: Vận tải hàng hóa bằng đường bộ-(trừ hóa lỏng khí để vận chuyển); 5320: Chuyển phát-; 5610: Nhà hàng và các dịch vụ ăn uống phục vụ lưu động-; 7990: Dịch vụ đặt chỗ và các dịch vụ hỗ trợ liên quan đến quảng bá và tổ chức tua du lịch-Chi tiết: Cung cấp các dịch vụ đặt chỗ liên quan đến hoạt động du lịch: vận tải, khách sạn, nhà hàng, cho thuê xe, giải trí và thể thao; Hoạt động bán vé cho các sự kiện sân khấu, thể thao và các sự kiện vui chơi, giải trí khác; Cung cấp dịch vụ hỗ trợ khách du lịch: cung cấp thông tin du lịch cho khách, hoạt động hướng dẫn du lịch; Hoạt động xúc tiến du lịch.; 7730: Cho thuê máy móc, thiết bị và đồ dùng hữu hình khác không kèm người điều khiển-Chi tiết: Cho thuê thiết bị hàng không; 4610: Đại lý, môi giới, đấu giá hàng hóa-Chi tiết:_x000D_
- Đại lý bán lẻ xăng dầu._x000D_
- Dịch vụ đại lý cho các hãng hàng không, các công ty vận tải, du lịch trong nước và nước ngoài; 8532: Đào tạo trung cấp-Chi tiết: Huấn luyện nhân viên kỹ thuật và các nhân viên chuyên ngành hàng không khác (không hoạt động tại trụ sở).; 5223: Hoạt động dịch vụ hỗ trợ trực tiếp cho vận tải hàng không-Chi tiết:	_x000D_
- Cung ứng các dịch vụ tại nhà ga hành khách, ga hàng hóa và các dịch vụ phục vụ sân đỗ tại các cảng hàng không, sân bay; cung ứng các dịch vụ phục vụ kỹ thuật, thương mại mặt đất cho hành khách và tàu bay của các hãng hàng không bao gồm: Dịch vụ phục vụ hành khách đi, đến và chuyển tiếp; dịch vụ phục vụ hành lý đi, đến và chuyển tiếp; dịch vụ phục vụ kỹ thuật mặt đất hàng không; dịch vụ làm tài liệu, cân bằng trọng tải và hướng dẫn chất xếp cho các chuyến bay; dịch vụ phục vụ vệ sinh, cung cấp vật tư vật phẩm lên máy bay; dịch vụ tìm kiếm và giao trả hành lý thất lạc; các dịch vụ khác có liên quan đến dây chuyền phục vụ kỹ thuật, thương mại mặt đất cho tàu bay của các hãng hàng không;_x000D_
- Dịch vụ chuyên ngành hàng không khác (dịch vụ tổ chức các sự kiện hàng không; dịch vụ bảo trì, cho thuê hệ thống công nghệ thông tin chuyên ngành hàng không; dịch vụ đưa tiễn hành khách; dịch vụ xếp phát ấn phẩm quảng cáo hàng không; dịch vụ cung cấp thông tin phục vụ bay; dịch vụ khai thác nhà ga, kho hàng hóa; dịch vụ cung cấp suất ăn hàng không; dịch vụ kỹ thuật hàng không)_x000D_
- Cung ứng dịch vụ thương mại, du lịch, khách sạn, bán hàng miễn thuế tại nhà ga hàng không và các tỉnh, thành phố; các dịch vụ hàng không khác (dịch vụ phục vụ hàng hóa; dịch vụ kỹ thuật hàng không; các dịch vụ được mô tả trong hợp đồng phục vụ mặt đất chuẩn của IATA).;3315: Sửa chữa và bảo dưỡng phương tiện vận tải (trừ ô tô, mô tô, xe máy và xe có động cơ khác)-Chi tiết:_x000D_
- Dịch vụ sửa chữa và bảo dưỡng các trang thiết bị kỹ thuật, xe đặc chủng phục vụ dây chuyền vận tải hàng không; bảo dưỡng thiết bị hàng không và các thiết bị kỹ thuật khác;;2651: Sản xuất thiết bị đo lường, kiểm tra, định hướng và điều khiển-Chi tiết: Sản xuất trang thiết bị kỹ thuật và các nội dung khác thuộc lĩnh vực công nghiệp hàng không.;5229: Hoạt động dịch vụ hỗ trợ khác liên quan đến vận tải-Chi tiết: Dịch vụ Logistics; Đại lý vé máy bay; Dịch vụ giao nhận hàng hóa (trừ hóa lỏng khí để vận chuyển và hoạt động liên quan đến vận tải đường hàng không).; 7020: Hoạt động tư vấn quản lý-(trừ tư vấn tài chính, kế toán, pháp luật);3030: Sản xuất máy bay, tàu vũ trụ và máy móc liên quan-Chi tiết: Sản xuất các trang thiết bị phục vụ dây chuyền vận tải hàng không.;4661: Bán buôn nhiên liệu rắn, lỏng, khí và các sản phẩm liên quan-Chi tiết: Cung ứng xăng dầu, mỡ hàng không (bao gồm nhiên liệu, dầu mỡ bôi trơn và chất lỏng chuyên dùng) và xăng dầu khác tại các Cảng hàng không sân bay;;7830: Cung ứng và quản lý nguồn lao động-Chi tiết: Cung ứng và quản lý nguồn lao động trong nước; Cung ứng và quản lý nguồn lao động đi làm việc ở nước ngoài; 7490: Hoạt động chuyên môn, khoa học và công nghệ khác chưa được phân vào đâu-Chi tiết: Hoạt động khoa học công nghệ (trừ môi giới chứng khoán);6810: Kinh doanh bất động sản, quyền sử dụng đất thuộc chủ sở hữu, chủ sử dụng hoặc đi thuê-Chi tiết: kinh doanh bất động sản;8299: Hoạt động dịch vụ hỗ trợ kinh doanh khác còn lại chưa được phân vào đâu-Chi tiết: Kinh doanh dịch vụ thương mại điện tử.;7310: Quảng cáo-;4659: Bán buôn máy móc, thiết bị và phụ tùng máy khác-Chi tiết: _x000D_
- Xuất, nhập khẩu các trang thiết bị phục vụ dây chuyền vận tải hàng không._x000D_
- Xuất nhập khẩu thiết bị hàng không;                 Doanh nghiệp phải thực hiện đúng các quy định của pháp luật về đất đai, xây dựng, phòng cháy chữa cháy, bảo vệ môi trường, các quy định khác của pháp luật có liên quan đến hoạt động của doanh nghiệp và các điều kiện kinh doanh đối với ngành nghề kinh doanh có điều kiện.; ",công ty trách nhiệm hữu hạn một thành viên dịch vụ mặt đất sân bay việt nam | 313587386
313599208,DOANH NGHIỆP TƯ NHÂN THƯƠNG MẠI VÀNG BẠC ĐÁ QUÝ KIM CÚC,DOANH NGHIỆP TƯ NHÂN THƯƠNG MẠI VÀNG BẠC ĐÁ QUÝ KIM CÚC,04/01/2016,2016-01-04,Doanh nghiệp tư nhân,"169 Đường liên khu 4-5, Phường Bình Hưng Hòa B, Quận Bình Tân, Thành phố Hồ Chí Minh, Việt Nam","169 Đường liên khu 4-5, Phường Bình Hưng Hòa B, Quận Bình Tân, Thành phố Hồ Chí Minh, Việt Nam","3211: Sản xuất đồ kim hoàn và chi tiết liên quan-Chi tiết: Sản xuất, gia công vàng trang sức, mỹ nghệ (trừ vàng miếng);4773: Bán lẻ hàng hóa khác mới trong các cửa hàng chuyên doanh-Chi tiết: Mua vàng trang sức, mỹ nghệ (trừ mua bán vàng miếng). Bán lẻ đá quý và đá bán quý; bạc trang sức, mỹ nghệ.;6492: Hoạt động cấp tín dụng khác-Chi tiết: Dịch vụ cầm đồ.;",doanh nghiệp tư nhân thương mại vàng bạc đá quý kim cúc | 313599208
313640209,CÔNG TY TNHH THƯƠNG MẠI THIÊN NHẬT PHÁT,CÔNG TY Trách nhiệm hữu hạn THƯƠNG MẠI THIÊN NHẬT PHÁT,28/01/2016,2016-01-28,Công ty trách nhiệm hữu hạn một thành viên,"186 Lưu Hữu Phước, Phường 15, Quận 8, Thành phố Hồ Chí Minh, Việt Nam","186 Lưu Hữu Phước, Phường 15, Quận 8, Thành phố Hồ Chí Minh, Việt Nam","2592: Gia công cơ khí; xử lý và tráng phủ kim loại-(không hoạt động tại trụ sở); 0810: Khai thác đá, cát, sỏi, đất sét-(không hoạt động tại trụ sở); 1322: Sản xuất hàng may sẵn (trừ trang phục)-(trừ tẩy, nhuộm, hồ, in trên các sản phẩm vải sợi, dệt, may, thêu, đan và gia công hàng đã qua sử dụng tại trụ sở); 1410: May trang phục (trừ trang phục từ da lông thú)-(trừ tẩy, nhuộm, hồ, in trên các sản phẩm vải sợi, dệt, may, thêu, đan và gia công hàng đã qua sử dụng tại trụ sở); 1811: In ấn-(không hoạt động tại trụ sở).;1812: Dịch vụ liên quan đến in-;5012: Vận tải hàng hóa ven biển và viễn dương-; 5022: Vận tải hàng hóa đường thuỷ nội địa-; 5229: Hoạt động dịch vụ hỗ trợ khác liên quan đến vận tải-Chi tiết: hoạt động của các đại lý làm thủ tục hải quan; dịch vụ giao nhận hàng hóa; 4661: Bán buôn nhiên liệu rắn, lỏng, khí và các sản phẩm liên quan-Chi tiết: bán buôn xăng dầu và các sản phẩm liên quan (Trừ kinh doanh dầu mỏ khí hóa lỏng LPG và dầu nhớt cặn) _x000D_
(trừ kinh doanh ga tại TPHCM); 4662: Bán buôn kim loại và quặng kim loại-Chi tiết: Bán buôn sắt, thép, nhôm.;4663: Bán buôn vật liệu, thiết bị lắp đặt khác trong xây dựng-Chi tiết: Bán buôn tre, nứa, gỗ cây và gỗ chế biến. Bán buôn vật liệu, thiết bị lắp đặt khác trong xây dựng;4669: Bán buôn chuyên doanh khác chưa được phân vào đâu-Chi tiết: Bán buôn giấy. Bán buôn phế liệu, phế thải kim loại, phi kim loại (không hoạt động tại trụ sở). Bán buôn hóa chất sử dụng trong lĩnh vực công nghiệp. Bán buôn bột giấy, hạt nhựa, chất dẻo dạng nguyên sinh, nhựa đường, tơ, xơ, sợi dệt, bán buôn phụ liệu may mặc và giày dép; 5912: Hoạt động hậu kỳ-(không thực hiện các hiệu ứng cháy, nổ; không sử dụng chất nổ, chất cháy, hóa chất làm đạo cụ, dụng cụ thực hiện các chương trình văn nghệ, sự kiện, phim, ảnh); 3011: Đóng tàu và cấu kiện nổi-(không hoạt động tại trụ sở); 3312: Sửa chữa máy móc, thiết bị-(trừ gia công cơ khí, tái chế phế thải, xi mạ điện tại trụ sở); 3313: Sửa chữa thiết bị điện tử và quang học-(trừ gia công cơ khí, tái chế phế thải, xi mạ điện tại trụ sở); 3315: Sửa chữa và bảo dưỡng phương tiện vận tải (trừ ô tô, mô tô, xe máy và xe có động cơ khác)-Chi tiết: Sửa chữa và bảo dưỡng định kỳ tàu thuyền (trừ gia công cơ khí, tái chế phế thải, xi mạ điện tại trụ sở); 3319: Sửa chữa thiết bị khác-(trừ gia công cơ khí, tái chế phế thải, xi mạ điện tại trụ sở); 4100: Xây dựng nhà các loại-; 4312: Chuẩn bị mặt bằng-; 4321: Lắp đặt hệ thống điện-Chi tiết: Lắp đăt:- Dây dẫn và thiết bị điện _x000D_
- Đường dây thông tin liên lạc _x000D_
- Mạng máy tính và dây cáp truyền hình, bao gồm cả cáp quang học _x000D_
- Hệ thống chiếu sáng _x000D_
- Chuông báo cháy _x000D_
- Hệ thống báo động chống trộm; 4511: Bán buôn ô tô và xe có động cơ khác-;4512: Bán lẻ ô tô con (loại 12 chỗ ngồi trở xuống)-;4520: Bảo dưỡng, sửa chữa ô tô và xe có động cơ khác-(trừ gia công cơ khí, tái chế phế thải, xi mạ điện tại trụ sở).;4530: Bán phụ tùng và các bộ phận phụ trợ của ô tô và xe có động cơ khác-;4541: Bán mô tô, xe máy-;4542: Bảo dưỡng và sửa chữa mô tô, xe máy-(trừ gia công cơ khí, tái chế phế thải, xi mạ điện tại trụ sở).;4543: Bán phụ tùng và các bộ phận phụ trợ của mô tô, xe máy-;4620: Bán buôn nông, lâm sản nguyên liệu (trừ gỗ, tre, nứa) và động vật sống-Chi tiết: Bán buôn nông, lâm sản nguyên liệu (trừ gỗ, tre, nứa) và động vật sống; Bán buôn cây và hoa (không hoạt động tại trụ sở); 4631: Bán buôn gạo-(không hoạt động tại trụ sở); 4632: Bán buôn thực phẩm-(không hoạt động tại trụ sở); 4641: Bán buôn vải, hàng may sẵn, giày dép-; 4649: Bán buôn đồ dùng khác cho gia đình-Chi tiết: Bán buôn sách, báo, tạp chí, văn phòng phẩm. Bán buôn đồ điện gia dụng, đèn và bộ đèn điện. Bán buôn giường, tủ, bàn ghế và đồ dùng nội thất. Bán buôn nước hoa, hàng mỹ phẩm và chế phẩm vệ sinh. Bán buôn vali, cặp, túi, hàng da và giả da khác. Bán buôn dụng cụ y tế, bán buôn hàng gốm, sứ, thủy tinh, dao, kéo; 4652: Bán buôn thiết bị và linh kiện điện tử, viễn thông-; 4653: Bán buôn máy móc, thiết bị và phụ tùng máy nông nghiệp-; 4659: Bán buôn máy móc, thiết bị và phụ tùng máy khác-Chi tiết: bán buôn máy móc, thiết bị y tế; Bán buôn máy móc, thiết bị và phụ tùng máy khác; 4932: Vận tải hành khách đường bộ khác-;4933: Vận tải hàng hóa bằng đường bộ-;8230: Tổ chức giới thiệu và xúc tiến thương mại-Chi tiết: Tổ chức sự kiện (không thực hiện các hiệu ứng cháy, nổ; không sử dụng chất nổ, chất cháy, hóa chất làm đạo cụ, dụng cụ thực hiện các chương trình văn nghệ, sự kiện, phim, ảnh); 9511: Sửa chữa máy vi tính và thiết bị ngoại vi-(trừ gia công cơ khí, tái chế phế thải, xi mạ điện tại trụ sở); 9512: Sửa chữa thiết bị liên lạc-(trừ gia công cơ khí, tái chế phế thải, xi mạ điện tại trụ sở); 6619: Hoạt động hỗ trợ dịch vụ tài chính chưa được phân vào đâu-Chi tiết: hoạt động tư vấn đầu tư (trừ tư vấn tài chính, kế toán, pháp lý); 7310: Quảng cáo-;7320: Nghiên cứu thị trường và thăm dò dư luận-(không thực hiện các hiệu ứng cháy, nổ; không sử dụng chất nổ, chất cháy, hóa chất làm đạo cụ, dụng cụ thực hiện các chương trình văn nghệ, sự kiện, phim, ảnh); 7410: Hoạt động thiết kế chuyên dụng-Chi tiết: hoạt động trang trí nội, ngoại thất; 7420: Hoạt động nhiếp ảnh-(trừ sản xuất phim); 7710: Cho thuê xe có động cơ-; 7730: Cho thuê máy móc, thiết bị và đồ dùng hữu hình khác-Chi tiết: Cho thuê máy móc, thiết bị xây dựng; 7830: Cung ứng và quản lý nguồn lao động-chi tiết: cung ứng và quản lý nguồn lao động trong nước (trừ cho thuê lại lao động);                                     ",công ty trách nhiệm hữu hạn thương mại thiên nhật phát | 313640209
313598490,CÔNG TY TNHH TƯ VẤN XÂY DỰNG GOLDEN PENTHOUSE,CÔNG TY Trách nhiệm hữu hạn TƯ VẤN XÂY DỰNG GOLDEN PENTHOUSE,04/01/2016,2016-01-04,Công ty trách nhiệm hữu hạn một thành viên,"28/80 Phan Tây Hồ, Phường 07, Quận Phú Nhuận, Thành phố Hồ Chí Minh, Việt Nam","28/80 Phan Tây Hồ, Phường 07, Quận Phú Nhuận, Thành phố Hồ Chí Minh, Việt Nam","4663: Bán buôn vật liệu, thiết bị lắp đặt khác trong xây dựng-(không hoạt động tại trụ sở).;4100: Xây dựng nhà các loại-;4210: Xây dựng công trình đường sắt và đường bộ-;4220: Xây dựng công trình công ích-;4290: Xây dựng công trình kỹ thuật dân dụng khác-;4311: Phá dỡ-;4312: Chuẩn bị mặt bằng-;4321: Lắp đặt hệ thống điện-(không gia công cơ khí, tái chế phế thải, xi mạ điện tại trụ sở).;4322: Lắp đặt hệ thống cấp, thoát nước, lò sưởi và điều hoà không khí-(trừ lắp đặt các thiết bị lạnh (thiết bị cấp đông, kho lạnh, máy đá, điều hòa không khí, làm lạnh nước) sử dụng ga lạnh R22 trong lĩnh vực chế biến thủy hải sản);4329: Lắp đặt hệ thống xây dựng khác-(không gia công cơ khí, tái chế phế thải, xi mạ điện tại trụ sở).;4330: Hoàn thiện công trình xây dựng-;4390: Hoạt động xây dựng chuyên dụng khác-;7020: Hoạt động tư vấn quản lý-(trừ tư vấn tài chính, kế toán, pháp lý).;7110: Hoạt động kiến trúc và tư vấn kỹ thuật có liên quan-Chi tiết: Thiết kế kết cấu công trình dân dụng và công nghiệp. Thiết kế kết cấu công trình cầu, đường bộ. Thiết kế kiến trúc công trình. Thiết kế nội-ngoại thất công trình. Thiết kế quy hoạch xây dựng. Thiết kế điện công trình dân dụng và công nghiệp. Thiết kế cơ điện công trình. Thiết kế hệ thống phòng cháy chữa cháy công trình xây dựng. Thiết kế nhiệt và thông gió trong công trình xây dựng. Thiết kế mạng thông tin liên lạc trong công trình xây dựng. Thiết kế hệ thống xử lý nước thải, khí thải, chất thải công trình xây dựng. Thiết kế cấp, thoát nước công trình xây dựng. Khảo sát địa chất công trình xây dựng. Khảo sát địa hình công trình xây dựng. Kiểm định chất lượng công trình xây dựng. Thẩm tra thiết kế kiến trúc công trình. Thẩm tra thiết kế kết cấu công trình dân dụng và công nghiệp. Quản lý dự án đầu tư xây dựng. Tư vấn đấu thầu. Hoạt động đo đạc bản đồ. Thiết kế chiếu sáng công trình dân dụng và công nghiệp. Thiết kế kết cấu công trinh thủy lợi, thủy điện.;7410: Hoạt động thiết kế chuyên dụng-;8129: Vệ sinh nhà cửa và các công trình khác-;8130: Dịch vụ chăm sóc và duy trì cảnh quan-;",công ty trách nhiệm hữu hạn tư vấn xây dựng golden penthouse | 313598490
